<?xml version="1.0" encoding="UTF-8"?>
<pluginApp xmlns="http://pspi.magic.ubc.ca"
           xmlns:xsi="http://www.w3.org/2001/XMLSchema-instance"
           xsi:schemaLocation="http://pspi.magic.ubc.ca application.xsd">
           
    <applicationName>Hello World</applicationName>
    <applicationShortName>hello</applicationShortName>
    <applicationImageURL>http://localhost/hello/hello.png</applicationImageURL>
    <minumumIdleTime>20</minumumIdleTime>
    
    <applicationDescription>This application is a sample application.</applicationDescription>
    <interactionInstructions>Visit the Getting Started guide.</interactionInstructions>
    
    <connectionInfo applicationType="web" useFullScreen="false">
        <topic>hello</topic>
        <displayURL>http://localhost/hello/index.html</displayURL>
        <connectorClass>ca.ubc.magic.coffeeshop.connectors.HelloConnector</connectorClass>
    </connectionInfo>
    
</pluginApp>
