<?xml version="1.0" encoding="UTF-8"?>
<pluginApp xmlns="http://pspi.magic.ubc.ca"
           xmlns:xsi="http://www.w3.org/2001/XMLSchema-instance"
           xsi:schemaLocation="http://pspi.magic.ubc.ca application.xsd">
           
    <applicationName>Bomberman</applicationName>
    <applicationShortName>bomberman_swf</applicationShortName>
    <applicationImageURL>http://kimberly.magic.ubc.ca:8080/CoffeeShop/img/bomberman.png</applicationImageURL>
    <minumumIdleTime>30</minumumIdleTime>
    
    <applicationDescription>This is a description of the bomberman application.  You can use this as you would any application currently deployed</applicationDescription>
    <interactionInstructions>You need to do stuff with this application.</interactionInstructions>
    <connectionInfo applicationType="web" useFullScreen="false">
        <topic>cs_bomberman_swf</topic>
        <displayURL>http://pspi.magic.ubc.ca:8080/Bomberman/</displayURL>
        <connectorClass></connectorClass>
    </connectionInfo>
  
</pluginApp>
